{
  "$schema": "http://json-schema.org/draft-03/schema#",
  "id": "http://popoloproject.com/schemas/post.json#",
  "title": "Post",
  "description": "A position that exists independent of the person holding it",
  "type": "object",
  "properties": {
    "id": {
      "description": "The post's unique identifier",
      "type": ["string", "null"]
    },
    "label": {
      "description": "A label describing the post",
      "type": "string",
      "required": true
    },
    "role": {
      "description": "The role that the holder of the post fulfills",
      "type": "string",
      "required": true
    },
    "person_id": {
      "description": "The ID of the person who holds the post",
      "type": ["string", "null"]
    },
    "organization_id": {
      "description": "The ID of the organization in which the post is held",
      "type": ["string", "null"]
    },
    "links": {
      "description": "URLs for documents about the person",
      "type": "array",
      "items": {
        "$ref": "http://popoloproject.com/schemas/link.json#"
      }
    },
    "contact_details": {
      "description": "Means of contacting the person who holds the post",
      "type": "array",
      "items": {
        "$ref": "http://popoloproject.com/schemas/contact_detail.json#"
      }
    }
  }
}
