{
  "id": "abc-inc-chef",
  "label": "Chef at Joe's Diner",
  "person_id": "john-q-public",
  "organization_id": "abc-inc",
  "role": "Chef",
  "contact_details": [
    {
      "label": "Take-out and delivery",
      "type": "tollfree",
      "value": "+1-800-555-0199",
      "note": "12pm to midnight"
    }
  ],
  "links": [
    {
      "url": "http://example.com/abc-inc/staff",
      "note": "ABC, Inc. staff page"
    }
  ]
}
